{"facts":{"a":true,"b":false,"c":true},"fragment":"ClosedBooleanBranches-v1","input_schema":"yuho.kernel-input/v1","operation":"evaluate","policy":{"max_nodes":1024,"reference_date":"2026-09-12"},"program":{"children":[],"definitions":false,"id":"synthetic:S","path":["S"],"requirements":[{"id":"group:all","kind":"all","members":[{"id":"a","kind":"leaf","path":["S"],"span":{"end":1,"end_col":2,"end_line":1,"start":0,"start_col":1,"start_line":1}},{"id":"group:any","kind":"any","members":[{"id":"b","kind":"leaf","path":["S"],"span":{"end":3,"end_col":2,"end_line":2,"start":2,"start_col":1,"start_line":2}},{"id":"b","kind":"leaf","path":["S"],"span":{"end":5,"end_col":2,"end_line":3,"start":4,"start_col":1,"start_line":3}}],"path":["S"],"span":{"end":5,"end_col":2,"end_line":3,"start":2,"start_col":1,"start_line":2}}],"path":["S"],"span":{"end":5,"end_col":2,"end_line":3,"start":0,"start_col":1,"start_line":1}}],"span":{"end":5,"end_col":2,"end_line":3,"start":0,"start_col":1,"start_line":1}},"protocol":"yuho.kernel-protocol/v1","request_id":"R02","source":{"path":"experiments/language-spike/fixtures/sources/closed-boolean.yh","sha256":"880553fca8fcea94e325ee2cfb48e5a985cc797f39a14cc6d3cedecfeb2ae4d2","text":"a\nb\nc\n"}}
