{"fragment":"ClosedBooleanBranches-v1","input_schema":"yuho.kernel-input/v1","operation":"validate","parser_result":{"accepted":false,"diagnostics":[{"code":"Y0103","parameters":{"node_type":"KNOWN_TYPED_STRUCT_LITERAL_AMBIGUITY"},"path":"experiments/language-spike/fixtures/sources/P04.yh","severity":"error","span":{"end":185,"end_col":13,"end_line":8,"start":173,"start_col":1,"start_line":8},"stage":"parse"}],"source_version":"yuho-5.1"},"policy":{"max_nodes":1024,"reference_date":"2026-09-12"},"protocol":"yuho.kernel-protocol/v1","request_id":"P04","source":{"path":"experiments/language-spike/fixtures/sources/P04.yh","sha256":"4ebeaac7edf7cb17000b56e56e3884a285198ad2bf0d6fbb8fbe5dffb3b3eb65","text":"struct Foo { bool a, bool b }\n\nfn check(bool x, bool y) : bool {\n    match { case _ := consequence FALSE; }\n}\n\n// this comment triggers the stale generated parser ambiguity\nFoo p := Foo { a := TRUE, b := FALSE }\nassert check(p.a, p.b) == TRUE\n"}}
