{"fragment":"ClosedBooleanBranches-v1","input_schema":"yuho.kernel-input/v1","operation":"validate","parser_result":{"accepted":true,"diagnostics":[{"code":"Y0101","parameters":{"node_type":"MISSING:}"},"path":"experiments/language-spike/fixtures/sources/P02.yh","severity":"error","span":{"end":19,"end_col":20,"end_line":1,"start":19,"start_col":20,"start_line":1},"stage":"parse"}],"source_version":"yuho-5.1"},"policy":{"max_nodes":1024,"reference_date":"2026-09-12"},"protocol":"yuho.kernel-protocol/v1","request_id":"H07","source":{"path":"experiments/language-spike/fixtures/sources/P02.yh","sha256":"4251bd3096ff5d9fe3b3a366d5471f24943ccd20cd448feb1ad53ae23103017e","text":"statute 1 \"Caf\u00e9\" {\n"}}
