{"fragment":"ClosedBooleanBranches-v1","input_schema":"yuho.kernel-input/v1","operation":"validate","parser_result":{"accepted":false,"diagnostics":[{"code":"Y0101","parameters":{"node_type":"MISSING:}"},"path":"experiments/language-spike/fixtures/sources/P03.yh","severity":"error","span":{"end":17,"end_col":18,"end_line":1,"start":17,"start_col":18,"start_line":1},"stage":"parse"}],"source_version":"yuho-5.1"},"policy":{"max_nodes":1024,"reference_date":"2026-09-12"},"protocol":"yuho.kernel-protocol/v1","request_id":"P03","source":{"path":"experiments/language-spike/fixtures/sources/P03.yh","sha256":"6ce158b6070d0ce274c8c36b0806e918b8bed69acb54449f1f5ae82e96ce25bd","text":"statute 1 \"Bad\" {"}}
